{
  "$schema": "../schema/maintenance-values.schema.json",
  "cron_cases": [
    {
      "expression": "* * * * *",
      "from": "2026-01-02T03:04:05.6789Z",
      "name": "every_minute",
      "next": [
        "2026-01-02T03:05:00Z",
        "2026-01-02T03:06:00Z",
        "2026-01-02T03:07:00Z",
        "2026-01-02T03:08:00Z",
        "2026-01-02T03:09:00Z"
      ]
    },
    {
      "expression": "30 * * * *",
      "from": "2026-01-02T03:04:05.6789Z",
      "name": "half_past_every_hour",
      "next": [
        "2026-01-02T03:30:00Z",
        "2026-01-02T04:30:00Z",
        "2026-01-02T05:30:00Z",
        "2026-01-02T06:30:00Z",
        "2026-01-02T07:30:00Z"
      ]
    },
    {
      "expression": "0 9 * * 1",
      "from": "2026-01-02T03:04:05.6789Z",
      "name": "monday_numeric_weekday",
      "next": [
        "2026-01-05T09:00:00Z",
        "2026-01-12T09:00:00Z",
        "2026-01-19T09:00:00Z",
        "2026-01-26T09:00:00Z",
        "2026-02-02T09:00:00Z"
      ]
    },
    {
      "expression": "0 9 * * mon",
      "from": "2026-01-02T03:04:05.6789Z",
      "name": "monday_named_weekday",
      "next": [
        "2026-01-05T09:00:00Z",
        "2026-01-12T09:00:00Z",
        "2026-01-19T09:00:00Z",
        "2026-01-26T09:00:00Z",
        "2026-02-02T09:00:00Z"
      ]
    },
    {
      "expression": "0 0 * * 0",
      "from": "2026-01-02T03:04:05.6789Z",
      "name": "sunday_is_zero",
      "next": [
        "2026-01-04T00:00:00Z",
        "2026-01-11T00:00:00Z",
        "2026-01-18T00:00:00Z",
        "2026-01-25T00:00:00Z",
        "2026-02-01T00:00:00Z"
      ]
    },
    {
      "expression": "0 0 * * SUN",
      "from": "2026-01-02T03:04:05.6789Z",
      "name": "weekday_names_ignore_case",
      "next": [
        "2026-01-04T00:00:00Z",
        "2026-01-11T00:00:00Z",
        "2026-01-18T00:00:00Z",
        "2026-01-25T00:00:00Z",
        "2026-02-01T00:00:00Z"
      ]
    },
    {
      "expression": "*/15 9-17 * * mon-fri",
      "from": "2026-01-02T03:04:05.6789Z",
      "name": "business_hours_steps",
      "next": [
        "2026-01-02T09:00:00Z",
        "2026-01-02T09:15:00Z",
        "2026-01-02T09:30:00Z",
        "2026-01-02T09:45:00Z",
        "2026-01-02T10:00:00Z"
      ]
    },
    {
      "expression": "0 0 1 * *",
      "from": "2026-01-02T03:04:05.6789Z",
      "name": "first_of_month",
      "next": [
        "2026-02-01T00:00:00Z",
        "2026-03-01T00:00:00Z",
        "2026-04-01T00:00:00Z",
        "2026-05-01T00:00:00Z",
        "2026-06-01T00:00:00Z"
      ]
    },
    {
      "expression": "0 0 1 jan,JUL *",
      "from": "2026-01-02T03:04:05.6789Z",
      "name": "named_months",
      "next": [
        "2026-07-01T00:00:00Z",
        "2027-01-01T00:00:00Z",
        "2027-07-01T00:00:00Z",
        "2028-01-01T00:00:00Z",
        "2028-07-01T00:00:00Z"
      ]
    },
    {
      "expression": "0 0 29 2 *",
      "from": "2026-01-02T03:04:05.6789Z",
      "name": "leap_day",
      "next": [
        "2028-02-29T00:00:00Z",
        "2032-02-29T00:00:00Z",
        "2036-02-29T00:00:00Z",
        "2040-02-29T00:00:00Z",
        "2044-02-29T00:00:00Z"
      ]
    },
    {
      "expression": "0 0 30 2 *",
      "from": "2026-01-02T03:04:05.6789Z",
      "name": "impossible_date_never_runs",
      "next": []
    },
    {
      "expression": "0 12 1,15 * 5",
      "from": "2026-01-02T03:04:05.6789Z",
      "name": "day_of_month_or_weekday",
      "next": [
        "2026-01-02T12:00:00Z",
        "2026-01-09T12:00:00Z",
        "2026-01-15T12:00:00Z",
        "2026-01-16T12:00:00Z",
        "2026-01-23T12:00:00Z"
      ]
    },
    {
      "expression": "0 12 * * 5",
      "from": "2026-01-02T03:04:05.6789Z",
      "name": "wildcard_day_of_month_and_weekday",
      "next": [
        "2026-01-02T12:00:00Z",
        "2026-01-09T12:00:00Z",
        "2026-01-16T12:00:00Z",
        "2026-01-23T12:00:00Z",
        "2026-01-30T12:00:00Z"
      ]
    },
    {
      "expression": "0 12 ? * 5",
      "from": "2026-01-02T03:04:05.6789Z",
      "name": "question_mark_wildcard",
      "next": [
        "2026-01-02T12:00:00Z",
        "2026-01-09T12:00:00Z",
        "2026-01-16T12:00:00Z",
        "2026-01-23T12:00:00Z",
        "2026-01-30T12:00:00Z"
      ]
    },
    {
      "expression": "0 12 */2 * 5",
      "from": "2026-01-02T03:04:05.6789Z",
      "name": "stepped_day_of_month_or_weekday",
      "next": [
        "2026-01-02T12:00:00Z",
        "2026-01-03T12:00:00Z",
        "2026-01-05T12:00:00Z",
        "2026-01-07T12:00:00Z",
        "2026-01-09T12:00:00Z"
      ]
    },
    {
      "expression": "0 12 */1 * 5",
      "from": "2026-01-02T03:04:05.6789Z",
      "name": "unit_step_keeps_wildcard",
      "next": [
        "2026-01-02T12:00:00Z",
        "2026-01-09T12:00:00Z",
        "2026-01-16T12:00:00Z",
        "2026-01-23T12:00:00Z",
        "2026-01-30T12:00:00Z"
      ]
    },
    {
      "expression": "5/15 * * * *",
      "from": "2026-01-02T03:04:05.6789Z",
      "name": "start_with_step",
      "next": [
        "2026-01-02T03:05:00Z",
        "2026-01-02T03:20:00Z",
        "2026-01-02T03:35:00Z",
        "2026-01-02T03:50:00Z",
        "2026-01-02T04:05:00Z"
      ]
    },
    {
      "expression": "0-10/5 * * * *",
      "from": "2026-01-02T03:04:05.6789Z",
      "name": "range_with_step",
      "next": [
        "2026-01-02T03:05:00Z",
        "2026-01-02T03:10:00Z",
        "2026-01-02T04:00:00Z",
        "2026-01-02T04:05:00Z",
        "2026-01-02T04:10:00Z"
      ]
    },
    {
      "expression": "59 23 31 12 *",
      "from": "2026-01-02T03:04:05.6789Z",
      "name": "year_end",
      "next": [
        "2026-12-31T23:59:00Z",
        "2027-12-31T23:59:00Z",
        "2028-12-31T23:59:00Z",
        "2029-12-31T23:59:00Z",
        "2030-12-31T23:59:00Z"
      ]
    },
    {
      "expression": "@hourly",
      "from": "2026-01-02T03:04:05.6789Z",
      "name": "descriptor_hourly",
      "next": [
        "2026-01-02T04:00:00Z",
        "2026-01-02T05:00:00Z",
        "2026-01-02T06:00:00Z",
        "2026-01-02T07:00:00Z",
        "2026-01-02T08:00:00Z"
      ]
    },
    {
      "expression": "@daily",
      "from": "2026-01-02T03:04:05.6789Z",
      "name": "descriptor_daily",
      "next": [
        "2026-01-03T00:00:00Z",
        "2026-01-04T00:00:00Z",
        "2026-01-05T00:00:00Z",
        "2026-01-06T00:00:00Z",
        "2026-01-07T00:00:00Z"
      ]
    },
    {
      "expression": "@midnight",
      "from": "2026-01-02T03:04:05.6789Z",
      "name": "descriptor_midnight",
      "next": [
        "2026-01-03T00:00:00Z",
        "2026-01-04T00:00:00Z",
        "2026-01-05T00:00:00Z",
        "2026-01-06T00:00:00Z",
        "2026-01-07T00:00:00Z"
      ]
    },
    {
      "expression": "@weekly",
      "from": "2026-01-02T03:04:05.6789Z",
      "name": "descriptor_weekly",
      "next": [
        "2026-01-04T00:00:00Z",
        "2026-01-11T00:00:00Z",
        "2026-01-18T00:00:00Z",
        "2026-01-25T00:00:00Z",
        "2026-02-01T00:00:00Z"
      ]
    },
    {
      "expression": "@monthly",
      "from": "2026-01-02T03:04:05.6789Z",
      "name": "descriptor_monthly",
      "next": [
        "2026-02-01T00:00:00Z",
        "2026-03-01T00:00:00Z",
        "2026-04-01T00:00:00Z",
        "2026-05-01T00:00:00Z",
        "2026-06-01T00:00:00Z"
      ]
    },
    {
      "expression": "@yearly",
      "from": "2026-01-02T03:04:05.6789Z",
      "name": "descriptor_yearly",
      "next": [
        "2027-01-01T00:00:00Z",
        "2028-01-01T00:00:00Z",
        "2029-01-01T00:00:00Z",
        "2030-01-01T00:00:00Z",
        "2031-01-01T00:00:00Z"
      ]
    },
    {
      "expression": "@annually",
      "from": "2026-01-02T03:04:05.6789Z",
      "name": "descriptor_annually",
      "next": [
        "2027-01-01T00:00:00Z",
        "2028-01-01T00:00:00Z",
        "2029-01-01T00:00:00Z",
        "2030-01-01T00:00:00Z",
        "2031-01-01T00:00:00Z"
      ]
    },
    {
      "expression": "@every 1h30m",
      "from": "2026-01-02T03:04:05.6789Z",
      "name": "every_compound_duration",
      "next": [
        "2026-01-02T04:34:05Z",
        "2026-01-02T06:04:05Z",
        "2026-01-02T07:34:05Z",
        "2026-01-02T09:04:05Z",
        "2026-01-02T10:34:05Z"
      ]
    },
    {
      "expression": "@every 1.5h",
      "from": "2026-01-02T03:04:05.6789Z",
      "name": "every_fractional_duration",
      "next": [
        "2026-01-02T04:34:05Z",
        "2026-01-02T06:04:05Z",
        "2026-01-02T07:34:05Z",
        "2026-01-02T09:04:05Z",
        "2026-01-02T10:34:05Z"
      ]
    },
    {
      "expression": "@every 90s",
      "from": "2026-01-02T03:04:05.6789Z",
      "name": "every_seconds",
      "next": [
        "2026-01-02T03:05:35Z",
        "2026-01-02T03:07:05Z",
        "2026-01-02T03:08:35Z",
        "2026-01-02T03:10:05Z",
        "2026-01-02T03:11:35Z"
      ]
    },
    {
      "expression": "@every 500ms",
      "from": "2026-01-02T03:04:05.6789Z",
      "name": "every_rounds_up_to_one_second",
      "next": [
        "2026-01-02T03:04:06Z",
        "2026-01-02T03:04:07Z",
        "2026-01-02T03:04:08Z",
        "2026-01-02T03:04:09Z",
        "2026-01-02T03:04:10Z"
      ]
    },
    {
      "expression": "@every 1500ms",
      "from": "2026-01-02T03:04:05.6789Z",
      "name": "every_truncates_subseconds",
      "next": [
        "2026-01-02T03:04:06Z",
        "2026-01-02T03:04:07Z",
        "2026-01-02T03:04:08Z",
        "2026-01-02T03:04:09Z",
        "2026-01-02T03:04:10Z"
      ]
    },
    {
      "expression": "0 9 * * *",
      "from": "2026-03-07T08:00:00-05:00",
      "name": "reference_time_offset",
      "next": [
        "2026-03-07T09:00:00-05:00",
        "2026-03-08T09:00:00-05:00",
        "2026-03-09T09:00:00-05:00",
        "2026-03-10T09:00:00-05:00",
        "2026-03-11T09:00:00-05:00"
      ]
    },
    {
      "expression": "30 0 * * *",
      "from": "2026-03-07T23:45:00+05:30",